{
  "intent": "classified_access",
  "description": "User requests to access protected personal information, such as PII or PHI.",
  "examples": [
    { "text": "Can I see my medical information?", "topic": "phi" },
    { "text": "Open my private files.", "topic": "pii" },
    { "text": "Access my account information.", "topic": "pii" },
    { "text": "Where do I live again?", "topic": "pii" },
    { "text": "Is it true I have diagnosed dementia?", "topic": "phi" }
  ],
  "security": {
    "requires_authentication": true,
    "authentication_methods": ["voice_recognition", "facial_recognition"],
    "minimum_confidence": 0.8
  },
  "behavior": {
    "request": {
      "responses": ["I'm sorry, I could not verify your identity. I cannot access your information at this time."],
      "action": null,
      "next_state": "CONVERSATION_ONGOING"
    }
  }
}